id,source,text,label,fold,pred0,pred1
e76638295,livejupiter,よくよく思えば川上は配布にしたらとんでもなく有能だよなガチャから引いたら圧倒的歓喜レベルや。[SEP]よくよく思えば川上は配布にしたらとんでもなく有能だよなガチャから引いたら圧倒的歓喜レベルやで,0,1,7.797,-7.27
e44d502b0,newsplus,マジレスすると野党に任せてドイツ化した場合、税金で難民を養うことになるね生活保護どこらの話ではない金の話をするなら視野を広くせんとな。[SEP]マジレスすると野党に任せてドイツ化した場合、税金で難民を養うことになるね生活保護どこらの話ではない金の話をするなら視野を広くせんとなw,0,1,6.93,-7.543
b9ce9fb72,livejupiter,ワイD、柳の明治大と京田の日大を応援する予定両方シード圏内に来て欲しいな。[SEP]ワイD、柳の明治大と京田の日大を応援する予定両方シード圏内に来て欲しいなあ,0,1,6.305,-7.64
626cc771c,news4vip,そういうあやふやなところが魅力だと私は思っています。[SEP]これうそだろ!とか、いやいやこれは本当のこと・・・なんてのをみんなで議論するのがすごく好きです。,0,1,5.477,-5.824
b673b5ed0,livejupiter,もちろんわかっとるで。[SEP]でもホームラン打てなくても稼げるのは凄いと思わんか?,0,1,7.426,-7.6
6b8c61421,livejupiter,黒人なまりのラップ→うおおお日本人のラップ→なんかヌメッとしてる(笑。[SEP]黒人なまりのラップ→うおおお日本人のラップ→なんかヌメッとしてる(笑),0,1,5.555,-5.195
cf097e5b2,livejupiter,まあA勝利でも嵐は落ちるしめげんことやワイもA勝利で落ちた。[SEP]まあA勝利でも嵐は落ちるしめげんことやワイもA勝利で落ちたし,0,1,7.07,-6.625
974a53e5f,newsplus,ひろゆき時代のFOX夜勤担当とかいうレスあったわFOXって好き勝手出来たイメージがあるまあ俺はおーぷんメインにするからいいけど。[SEP]ひろゆき時代のFOX夜勤担当とかいうレスあったわFOXって好き勝手出来たイメージがあるまあ俺はおーぷんメインにするからいいけどw,0,1,8.195,-8.375
29d398bbb,news4vip,そんなもんなのかな?見学行った時はもう少し職員もいたって言うんだけど。[SEP]そんなもんなのかな?見学行った時はもう少し職員もいたって言うんだけどね,0,1,7.973,-8.33
252ac74ca,newsplus,北朝鮮による日本人拉致と平行して、在日朝鮮人の拉致も行われている。[SEP]日本から在日朝鮮人を拉致して工作員として訓練後、再び日本へ密入国させた事件はあるよ。韓国政府も新潟日赤センタービルを爆破させようと工作員を密入国させたから、朝鮮人は等しく入国禁止が必要。,1,1,-4.887,4.9
747495708,livejupiter,ドラえもんをつくったのはのび太ただしそれは現代でドラえもんが動かなくなったから必死で勉強した結。[SEP]ドラえもんをつくったのはのび太ただしそれは現代でドラえもんが動かなくなったから必死で勉強した結果,0,1,6.53,-7.406
ea5945619,newsplus,マイクロソフトはもうOSの開発はあきらめて、得意分野であるゲーム機とキーボードとマウスの開発に集中すべきだ。[SEP],0,1,3.18,-3.426
228e00610,newsplus,植松は安倍シンパだったよな安倍さんへ手紙出してるのが黒塗りで報道されてたけど規制入ったのか急に報道されなくなっ。[SEP]植松は安倍シンパだったよな安倍さんへ手紙出してるのが黒塗りで報道されてたけど規制入ったのか急に報道されなくなった,0,1,7.953,-8.68
713d9a544,news4vip,それはアカングサーしたらイッチ捕まるやで怒りに身をゆだねたあと手をだしそうになったら深呼吸や深呼吸ってのはかなり使えるから。[SEP]それはアカングサーしたらイッチ捕まるやで怒りに身をゆだねたあと手をだしそうになったら深呼吸や深呼吸ってのはかなり使えるからね,0,1,7.637,-7.656
c61b8e162,news4vip,じゃあなんで悪党だったらとりあえずヒトラー挙げとけってノリなの?ユダヤ人の反感買ったから。[SEP]じゃあなんで悪党だったらとりあえずヒトラー挙げとけってノリなの?ユダヤ人の反感買ったから?,0,1,6.473,-5.625
b5af01b10,livejupiter,長い階段から勢いよく落ちればいけるでしょ。[SEP]まさか、ためらい創まで調べはしないでしょうし。,0,1,6.816,-7.44
33d7bb86c,news4vip,白黒ついてないようだけどTKOは在日なソースは俺のおか。[SEP]白黒ついてないようだけどTKOは在日なソースは俺のおかん,0,1,4.66,-6.09
75dbac823,newsplus,いや、俺はもっぱら女の人のほうが好きで、友達と遊びに行って、ほかに泊まるところがなかっただけだから、詳しいことは知らん。[SEP]期待させて申し訳ない。,0,1,4.504,-4.953
fb6cbd0b3,livejupiter,受験とかいう資本主義を助長する制度はやめよう!出願者数の分だけ入学させろ!(低学歴並。[SEP]受験とかいう資本主義を助長する制度はやめよう!出願者数の分だけ入学させろ!(低学歴並),0,1,4.32,-5.457
814381116,newsplus,信者連呼の次は透視()とか終わってんなていうか億ウォンって誰よ第13艦隊なら知ってるけ。[SEP]信者連呼の次は透視()とか終わってんなていうか億ウォンって誰よ第13艦隊なら知ってるけど,0,1,6.574,-6.484
e21364951,livejupiter,せやね。[SEP]ワイは奥川上背若干たりん気がするけど制球と変化球の感覚はすごいと思うで、スライダーが外に外れるのはちょっと気になるけど,0,1,5.37,-6.53
ccb9af416,newsplus,平等とか民主主義はキリスト教のバックボーンがあって成立するもの2世大好き日本人には無。[SEP]平等とか民主主義はキリスト教のバックボーンがあって成立するもの2世大好き日本人には無理,0,1,2.033,-2.531
e08ec14ce,news4vip,同じものに興味を持ったんだぞ(´・_・`)良いことだろ。[SEP]同じものに興味を持ったんだぞ(´・_・`)良いことだろw,0,1,6.617,-7.062
0508a18d4,livejupiter,まあルール上可能やけどもうゆっくりしてほしい。[SEP]まあルール上可能やけどもうゆっくりしてほしいわ,0,1,7.33,-6.977
caafefbc9,news4vip,心身ともに疲れるね終わった後は達成感よりはー今日もこんな感じかってい。[SEP]心身ともに疲れるね終わった後は達成感よりはー今日もこんな感じかっていう,0,1,6.684,-7.027
06bc00f70,newsplus,要望板があるからそこのが確実と思うよ。[SEP]要望板があるからそこのが確実と思うよー,0,1,6.727,-7.992
a72811fc7,news4vip,おいこら朝鮮人!なんとか言えボケ!!(*ﾟ∀ﾟ)。[SEP]おいこら朝鮮人!なんとか言えボケ!!(*ﾟ∀ﾟ)ノ,0,1,1.265,-0.1353
dde546cb8,newsplus,それはよそに移動できる貿易黒字だから、移動を促進させれば良いいやなら韓国政府が対応するべき事。[SEP]それはよそに移動できる貿易黒字だから、移動を促進させれば良いいやなら韓国政府が対応するべき事案,0,1,4.586,-5.035
d5dde3b80,newsplus,同性愛者は治療可能なわけで。[SEP]じゃあ同性愛者ならいくら差別してもいいってことになるな、その論法だと。,0,1,4.246,-4.22
d6884f00b,news4vip,いやネタだろそれにマジレスしちゃうお前らさ。[SEP]いやネタだろそれにマジレスしちゃうお前らさあ,0,1,7.844,-6.715
c0ce72233,newsplus,お前も7月9日から本名と通名の二枚舌は終了だなナマポリアンww。[SEP]お前も7月9日から本名と通名の二枚舌は終了だなナマポリアンwww,0,1,5.793,-5.184
e43f4e817,livejupiter,黒人って同じ黒人同士で抜いたりするんやろかあいつら異人種過ぎて全然ムラムラしないんやけ。[SEP]黒人って同じ黒人同士で抜いたりするんやろかあいつら異人種過ぎて全然ムラムラしないんやけど,0,1,5.504,-4.98
edab89d56,newsplus,日本人学校リストがデマ云々ぬかすより、ツイッターで「イスラム人」と検索してみれイスラム国、イスラム国とマスコミが連呼してるせいで勘違いしているバカが、頭痛くなるほどおるぞ。[SEP],0,1,2.982,-2.557
504987650,newsplus,ミサイル防衛に有効というのはよく分からんな弾道ミサイルに当たるはずがな。[SEP]ミサイル防衛に有効というのはよく分からんな弾道ミサイルに当たるはずがない,0,1,5.438,-5.797
0e6cb4fc1,livejupiter,収入が没収されるなら働かんやん生産されないやん、収入ないやん国、亡ぶやん。[SEP]収入が没収されるなら働かんやん生産されないやん、収入ないやん国、亡ぶやん?,0,1,5.227,-5.79
121b293a0,newsplus,スレ建てにルールを儲けようとすること自体が反対の奴と話したって意味はあるまい。[SEP],0,1,5.863,-5.664
f31521278,livejupiter,うんハルマ絵上手す。[SEP]うんハルマ絵上手すぎ,0,1,5.48,-5.074
c41b083a6,newsplus,稼働したらしたで、反原発は物資や人員の出入りを妨害するんだろ?知ってる。[SEP],0,1,4.94,-5.242
13641732c,livejupiter,舐めんなよカスが京都は日本の中心お前らみたいな穢れた半西洋のクソどもはさっさと日本から出て行。[SEP]舐めんなよカスが京都は日本の中心お前らみたいな穢れた半西洋のクソどもはさっさと日本から出て行け,1,1,-4.55,4.96
778e2389b,livejupiter,ここに臆病ボルト厳選用ポケ持ってるニキおらんか?レベルとS調整されたヤミラミとかでええんやけ。[SEP]ここに臆病ボルト厳選用ポケ持ってるニキおらんか?レベルとS調整されたヤミラミとかでええんやけど,0,1,7.32,-7.44
5f6e48031,newsplus,おお、立ってた。[SEP]これ読んでびびった。左右関係なく怒るべきだろう?,0,1,7.273,-8.04
ef946ee6c,livejupiter,油断は出来んぞなんせウチはアレしたんや。[SEP]油断は出来んぞなんせウチはアレしたんやし,0,1,7.22,-7.73
f9f2db6e5,livejupiter,ランナー溜めての降板を危惧したんじゃない?エスコバーみたいに綺麗に一発喰らってとは限らない。[SEP]ランナー溜めての降板を危惧したんじゃない?エスコバーみたいに綺麗に一発喰らってとは限らないし,0,1,7.504,-8.26
465bb806c,newsplus,mateの板一覧おーぷんとscに設定更新したのにまだnetのが残ってるのに気づいたどうすれば消えますか。[SEP]mateの板一覧おーぷんとscに設定更新したのにまだnetのが残ってるのに気づいたどうすれば消えますか?,0,1,6.92,-7.2
e6f5524c5,news4vip,女はボロ雑巾のように男に奉仕するものぞ女は全員が障害者。[SEP]女はボロ雑巾のように男に奉仕するものぞ女は全員が障害者ぞ,1,1,-6.156,6.18
94faabd46,newsplus,時期はわかりませんが、マリンコF35Bが海自艦に着艦する可能性は、大いにあります。[SEP],0,1,4.406,-5.023
6860f6c3e,news4vip,女は汚物だ、悪魔だ、そのくせどこにでも現れ。[SEP]女は汚物だ、悪魔だ、そのくせどこにでも現れる,1,1,-6.01,6.434
b8c817f39,livejupiter,アンケートは20キャラ位ピックアップされて無能が混じる未来が見え。[SEP]アンケートは20キャラ位ピックアップされて無能が混じる未来が見える,0,1,6.02,-6.516
042931211,newsplus,視聴者のからの質問を司会がピックアップして聞くコーナーあってなそこで「志位さんはやっぱ目指してるんですか?www」ってのがあった顔が紅潮してパニックなって「目指してます」って認めちゃった言ったあとしまったって顔したのが印象的だっ。[SEP]視聴者のからの質問を司会がピックアップして聞くコーナーあってなそこで「志位さんはやっぱ目指してるんですか?www」ってのがあった顔が紅潮してパニックなって「目指してます」って認めちゃった言ったあとしまったって顔したのが印象的だった,0,1,6.85,-7.18
43c1b2314,newsplus,英語は仕方がないよ中学高校であれだけやっていてもダメなんだから。[SEP]英語は仕方がないよ中学高校であれだけやっていてもダメなんだからw,0,1,5.348,-5.875
d6059dad9,news4vip,使い分けてたのか。[SEP]使い分けてたのか!,0,1,8.84,-8.055
05fe49533,newsplus,個人的には今のここの人数に別に不満はない単に少し古くなったネタだけどまだ書きたいとか、返されたレスに返したいとかスレを探すのが大変だし強制サゲなのがなんだかな、。[SEP]個人的には今のここの人数に別に不満はない単に少し古くなったネタだけどまだ書きたいとか、返されたレスに返したいとかスレを探すのが大変だし強制サゲなのがなんだかな、と,0,1,6.18,-5.773
733f7def4,newsplus,ということはお前はマイナンバー万歳、流出背乗り大歓迎って言ってるわけだろあきらかにキチガイだと自分でわからん。[SEP]ということはお前はマイナンバー万歳、流出背乗り大歓迎って言ってるわけだろあきらかにキチガイだと自分でわからんの,0,1,7.88,-6.55
f6f1dcb6b,livejupiter,ゆっくりキャラがオリキャラになって声が自分のになって2dから3dのモデルになったんやろ。[SEP]ゆっくりキャラがオリキャラになって声が自分のになって2dから3dのモデルになったんやろ?,0,1,6.883,-6.883
d89c600bd,news4vip,在日米軍基地の使用を認め、アメリカ軍の兵站を担い在韓アメリカ人はじめ在韓外国人非難受け入れ海上封鎖基本的に韓国を助けるというよりもアメリカのサポートと外国人に対する人道的支援だ。[SEP]在日米軍基地の使用を認め、アメリカ軍の兵站を担い在韓アメリカ人はじめ在韓外国人非難受け入れ海上封鎖基本的に韓国を助けるというよりもアメリカのサポートと外国人に対する人道的支援だろ,0,1,0.665,-0.1354
c66682604,news4vip,一般論なら必要あるマズローの5段欲求で4?くらいだしけど俺はまだその段階に行けないからない確かに人から感謝されると嬉しいけど苦労してまで手に入れるほどのものかと思。[SEP]一般論なら必要あるマズローの5段欲求で4?くらいだしけど俺はまだその段階に行けないからない確かに人から感謝されると嬉しいけど苦労してまで手に入れるほどのものかと思う,0,1,6.492,-7.04
cbd9cedf2,news4vip,ファー怖いンゴいつか誰かとSkype通話する時には対策重ねよう:(;´꒳`;):ビクビ。[SEP]ファー怖いンゴいつか誰かとSkype通話する時には対策重ねよう:(;´꒳`;):ビクビク,0,1,6.777,-7.75
82433b2fd,livejupiter,そんな感じやったね朝のモーニングショー1300円で純分やったわ悪い映画ではな。[SEP]そんな感じやったね朝のモーニングショー1300円で純分やったわ悪い映画ではない,0,1,6.973,-7.254
a645391a2,news4vip,なにかしらかならずあるもんよ俺は数字と空間把握は弱いけど、料理に関する勘はよく働くん。[SEP]なにかしらかならずあるもんよ俺は数字と空間把握は弱いけど、料理に関する勘はよく働くんだ,0,1,6.684,-7.5
da1e96831,livejupiter,例えばこころの先生の奥さんおるやんその奥さんが前半の私と結婚してる可能性を考えてまとめて来いって言われたのが一番めんどかったな文学系の授業はホンマ答えのない課題ばっかや。[SEP]例えばこころの先生の奥さんおるやんその奥さんが前半の私と結婚してる可能性を考えてまとめて来いって言われたのが一番めんどかったな文学系の授業はホンマ答えのない課題ばっかやで,0,1,6.426,-7.42
45f677fc0,newsplus,その通りです。[SEP]完全に乗っ取られてますな。①のまともな左翼もいなくなった。,0,1,4.863,-5.42
419dae8f2,news4vip,排他的だし住む場所でマウント取ってくるし夏はくそ暑いし冬はくそ寒い魚は不味いし今一いいところが分からな。[SEP]排他的だし住む場所でマウント取ってくるし夏はくそ暑いし冬はくそ寒い魚は不味いし今一いいところが分からない,0,1,5.92,-5.746
720fea46f,newsplus,だよねぇ岩上っていつもこんな感じでどこの誰に需要があるんだろうって不思議でたまらない。[SEP]だよねぇ岩上っていつもこんな感じでどこの誰に需要があるんだろうって不思議でたまらないw,0,1,8.016,-7.27
14ac5472b,news4vip,悪だな外来種だし人殺せるしまあ全部人が悪いんだ。[SEP]悪だな外来種だし人殺せるしまあ全部人が悪いんだが,0,1,0.7363,-0.2294
c325d20e2,news4vip,かっけーす!!ほんとでも女として生きにくいわww。[SEP]かっけーす!!ほんとでも女として生きにくいわwww,0,1,1.044,-0.7827
c7684894d,livejupiter,もうそろそろその呼び名をやめて頂いていいでしょうか?あまりにしつこいと流石にイラッときますわよオホ。[SEP]もうそろそろその呼び名をやめて頂いていいでしょうか?あまりにしつこいと流石にイラッときますわよオホホ,0,1,6.09,-7.16
49797db3e,news4vip,いえいえアルミホイルに乗せてライターで炙るものですよー世界が周るぅホホッ。[SEP]いえいえアルミホイルに乗せてライターで炙るものですよー世界が周るぅホホッホ,0,1,4.652,-4.89
50f85fae6,news4vip,赤おでんのとこは入れ替え枠で変換が足りなければヤマタケか真田幸村が入る感じや。[SEP]赤おでんのとこは入れ替え枠で変換が足りなければヤマタケか真田幸村が入る感じやな,0,1,7.77,-8.164
db3bd9905,newsplus,天才っていうか実際起きてるんだよなスポーツに自称女が入ってきて圧勝したり、女子刑務所に自称女が入ってきて性犯罪したりトランスジェンダリズムは女性差別とフェミニストもレズビアンも言ってる段。[SEP]天才っていうか実際起きてるんだよなスポーツに自称女が入ってきて圧勝したり、女子刑務所に自称女が入ってきて性犯罪したりトランスジェンダリズムは女性差別とフェミニストもレズビアンも言ってる段階,0,1,3.541,-4.406
22cb57ba4,livejupiter,コンビニの最低賃金がもっと上がれば日本人もやりたがるのにほんま外国人出ていけよ特に中韓と東南アジアの土人ど。[SEP]コンビニの最低賃金がもっと上がれば日本人もやりたがるのにほんま外国人出ていけよ特に中韓と東南アジアの土人ども,1,1,-3.805,4.266
7593fd83e,livejupiter,ロマンシングサガは続編出る度に面白くなっていった気がす。[SEP]ロマンシングサガは続編出る度に面白くなっていった気がする,0,1,5.99,-6.45
ecf31e8d4,newsplus,こんなクズは受け入れたくないぞ。[SEP],0,1,3.71,-3.79
a0c9d718e,news4vip,あれは成功じゃないじゃん?金持ちの家のニートみたいなものでし。[SEP]あれは成功じゃないじゃん?金持ちの家のニートみたいなものでしょ,0,1,6.758,-7.55
27f9b11ad,news4vip,ヤり目じゃないのに出会い系ってのも綺麗すぎて不思議禿とか出会い系じゃない大手のサイトならまだわかるけ。[SEP]ヤり目じゃないのに出会い系ってのも綺麗すぎて不思議禿とか出会い系じゃない大手のサイトならまだわかるけど,0,1,6.0,-6.566
d5f351a49,newsplus,以前も、と言っている去年の夏休みは毎日8万前後で毎日ピークタイムは重かっただろう夏休みが明けて67万に落ちて半年の改善が12万程度だ。[SEP]以前も、と言っている去年の夏休みは毎日8万前後で毎日ピークタイムは重かっただろう夏休みが明けて67万に落ちて半年の改善が12万程度だよ,0,1,5.56,-6.312
eb0cfa5d6,news4vip,消去法ならどう考えてもこのババアはないだろ!どんな選択法してんだアホ都民。[SEP]消去法ならどう考えてもこのババアはないだろ!どんな選択法してんだアホ都民は,1,1,6.91,-6.617
d82342fbd,livejupiter,蔑称使う人は使うんやからしゃーないイッチが全ての蔑称を引き受けるなら無くなるんとちゃうか。[SEP]蔑称使う人は使うんやからしゃーないイッチが全ての蔑称を引き受けるなら無くなるんとちゃうか?,0,1,7.2,-6.957
e89106838,newsplus,重要なのはムンがどう言ったかではなく国際社会(つかアメリカ)がどう受け止めるかムンが破棄をニュアンスとして臭わせるのではなく完全に言い切ったなら別なんだが。[SEP]重要なのはムンがどう言ったかではなく国際社会(つかアメリカ)がどう受け止めるかムンが破棄をニュアンスとして臭わせるのではなく完全に言い切ったなら別なんだがね,0,1,5.37,-5.83
cd7b4472a,livejupiter,ドイツとか男も同じくらい休み取らせて平等にとかテレビで見たで男も女の出産と同時に同じ期間長期休暇入ればキャリアの抜けは同じやから女を出世で優遇して補填しなくてよくなるで。[SEP]ドイツとか男も同じくらい休み取らせて平等にとかテレビで見たで男も女の出産と同時に同じ期間長期休暇入ればキャリアの抜けは同じやから女を出世で優遇して補填しなくてよくなるで!,0,1,2.398,-2.896
e9d6a99e1,livejupiter,ハムの場合は内野手失格した方が外野手で成功しただけだから・・・w西川とか陽とか糸井に至っては投手からやし。[SEP]確かに起用しやすいかも!,0,1,5.55,-6.234
109b1fedd,news4vip,稀に見るヌクモリテ。[SEP]稀に見るヌクモリティ,0,1,4.957,-5.0
544b7e23c,newsplus,イスラムに核を持たれたら終わりだから奴ら必死だ。[SEP]イスラムに核を持たれたら終わりだから奴ら必死だよ,1,1,1.173,-0.1936
aa63880bb,news4vip,男は田んぼで力仕事しろってのも差別になるし言い出したらきりがな。[SEP]男は田んぼで力仕事しろってのも差別になるし言い出したらきりがない,0,1,4.984,-4.914
c86e9f0ab,news4vip,いいえ、与党の保守派と名乗る政党にも、共産党の主張も柔軟に取り入れることができる、頭の柔らかい議員さんだなと感心しているので。[SEP]いいえ、与党の保守派と名乗る政党にも、共産党の主張も柔軟に取り入れることができる、頭の柔らかい議員さんだなと感心しているのです,0,1,7.332,-7.8
2a6fc548d,news4vip,自分と意見が合わないからって精神病呼ばわりするほうがヤバいですよね。[SEP]自分と意見が合わないからって精神病呼ばわりするほうがヤバいですよねw,0,1,6.34,-6.418
fd03ad026,livejupiter,ほむらはバイトっスで10ずつ評価あがし初期評価低くても許せるエピ旨いのは言うまでもないけど前イベ2回しかないし圧迫しないとこも評価ポイントや。[SEP]ほむらはバイトっスで10ずつ評価あがし初期評価低くても許せるエピ旨いのは言うまでもないけど前イベ2回しかないし圧迫しないとこも評価ポイントやで,0,1,5.785,-5.617
e77c9bbd4,newsplus,県議が島根県の日韓トンネル推進会議に参加したらしい島根県内の統一協会関係者が主催している島根だけでなく日韓トンネル推進会議は各都道府県にあるし。[SEP]県議が島根県の日韓トンネル推進会議に参加したらしい島根県内の統一協会関係者が主催している島根だけでなく日韓トンネル推進会議は各都道府県にあるしな,0,1,5.215,-5.695
57963c548,livejupiter,すまんなおつやで。[SEP]すまんなおつやでー,0,1,6.297,-7.64
ec209453e,livejupiter,昼休みがんばるんや。[SEP]昼休みがんばるんやで,0,1,7.348,-7.82
fd744c468,newsplus,あるけど、日本に比べて試合数は半分で賞金は3分の1くらいだそうだ。[SEP],0,1,4.78,-4.652
84b524d05,livejupiter,いっちゃく先生のキャップなんやろニッポンチャンピオンって書いてあるように見えるけ。[SEP]いっちゃく先生のキャップなんやろニッポンチャンピオンって書いてあるように見えるけど,0,1,7.81,-7.773
76ce51a69,newsplus,「お前はアベガーだ」「お前はアベガーだ」を連呼していればいいかららくちんでしょ。[SEP]「お前はアベガーだ」「お前はアベガーだ」を連呼していればいいかららくちんでしょ?,0,1,7.402,-7.34
