id,source,text,label,fold,pred0,pred1
8ddbdbefb,newsplus,奴らに反日やめろって言うのは「死ねっ」て言うのとおんなじなのいっぺん反日やめてみなよ、ウリ。[SEP]奴らに反日やめろって言うのは「死ねっ」て言うのとおんなじなのいっぺん反日やめてみなよ、ウリw,1,1,6.03,-6.53
d9ddee1ed,news4vip,嫁は友人と週末まで旅行だってんで冷蔵庫は空っぽはぁ…なんの為に働いてるのかわからなくな。[SEP]嫁は友人と週末まで旅行だってんで冷蔵庫は空っぽはぁ…なんの為に働いてるのかわからなくなる,0,1,6.906,-6.61
e9b6f0909,newsplus,いや普通に日教組のアカ教師やバックについてる奴らに吊し上げられて公私別なく圧力かけられて追い詰められたんだ。[SEP]いや普通に日教組のアカ教師やバックについてる奴らに吊し上げられて公私別なく圧力かけられて追い詰められたんだろ,0,1,8.21,-8.1
9776ac2e6,livejupiter,過去どうあったかは置いといても今は韓国が旗立てて韓国軍が占領しとるからどっからどう見ても韓国領なんだよな。[SEP]過去どうあったかは置いといても今は韓国が旗立てて韓国軍が占領しとるからどっからどう見ても韓国領なんだよなあ,0,1,3.787,-3.832
49a6ecbea,livejupiter,村上春樹がエッセイで言ってて共感できたこと「小説家が歌手や俳優になってもあまり歓迎はされないし、それどころか批判されることの方が多いけど、その逆の話はあまり聞きません。[SEP]作家というのはそういう割り込んで来る人達に比較的寛容なようです」,0,1,4.793,-5.71
12e5314cc,newsplus,切り離すメリットは軽くしていくことにあるからねえ・・・ただ韓国は過去に切り離しに何度も失敗してるんで失敗要因をなくしたニダ!って考えてるのかも?とは思う俺は専門知識あるわけじゃないので、解説できる人の降臨が待たれ。[SEP]切り離すメリットは軽くしていくことにあるからねえ・・・ただ韓国は過去に切り離しに何度も失敗してるんで失敗要因をなくしたニダ!って考えてるのかも?とは思う俺は専門知識あるわけじゃないので、解説できる人の降臨が待たれる,0,1,6.062,-5.867
06aba2b96,livejupiter,もらえないよ。[SEP]ビジター側の選手がもしかしたら来てくれるかもしれないけど、確率低いと思う,0,1,4.44,-5.35
3b320a390,news4vip,確かに!まとめた人の主観や思惑なんて一切介在しないし、根拠にするならやっぱりまとめが一番。[SEP]確かに!まとめた人の主観や思惑なんて一切介在しないし、根拠にするならやっぱりまとめが一番!,0,1,7.25,-6.98
83331eada,news4vip,豪華客船にミミズの化け物襲。[SEP]豪華客船にミミズの化け物襲来,0,1,3.129,-2.926
c4c2e9c28,livejupiter,日ハムってなにがわるいんや?打線投手守備チーム。[SEP]日ハムってなにがわるいんや?打線投手守備チーム?,0,1,5.82,-6.965
4dfc3e472,newsplus,メリケンの支那包囲網関連の話だからハイテク素材(死語)の件やと思う。[SEP]メリケンの支那包囲網関連の話だからハイテク素材(死語)の件やと思うよ,0,1,6.21,-5.6
4e2430c19,livejupiter,ん?巨大地震自体は人工のものやないの?あくまで先に自然の巨大地震があって、爆弾はただの補助なん。[SEP]ん?巨大地震自体は人工のものやないの?あくまで先に自然の巨大地震があって、爆弾はただの補助なん?,0,1,6.875,-8.14
e9c34dbf9,newsplus,恵方巻きなんて、やりたい連中にさせればいいじゃん。[SEP]ごり押し商法がイヤとか言いながら、恵方巻きを排除しようとごり押しする二重基準に寒気が走る。,0,1,4.65,-4.91
a5e28b401,newsplus,でも意味のない刺青彫っちゃうんだぜww。[SEP]でも意味のない刺青彫っちゃうんだぜwww,0,1,5.984,-5.848
d9368bcf9,livejupiter,スレタイにまんJ民が入ってるスレをまさか釣りじゃないと思ってたんか。[SEP]スレタイにまんJ民が入ってるスレをまさか釣りじゃないと思ってたんか?,0,1,7.66,-7.66
7b04f1df2,newsplus,AKIRA、千と千尋のスタッフが集結した作品らしいぞTVの紹介欄をみる。[SEP]AKIRA、千と千尋のスタッフが集結した作品らしいぞTVの紹介欄をみると,0,1,6.562,-7.254
51c2a269a,livejupiter,地学基礎とかいうセンターの穴しかもガバガバの大きな穴の模。[SEP]地学基礎とかいうセンターの穴しかもガバガバの大きな穴の模様,0,1,5.848,-6.57
f982fa403,news4vip,貧乏人とは言うが結婚して子供がいる世帯は年収2000万に届くまではみな貧乏人らしい。[SEP]貧乏人とは言うが結婚して子供がいる世帯は年収2000万に届くまではみな貧乏人らしいぞ,0,1,5.293,-4.086
5da21856f,news4vip,そそあまりデカすぎず、大通りのビル間をドシンドシン歩いてる姿って燃えるじゃん。[SEP]そそあまりデカすぎず、大通りのビル間をドシンドシン歩いてる姿って燃えるじゃん?,0,1,7.85,-7.836
ce0f1da64,livejupiter,体育祭は分かるがブレスの位置も決まってる合唱練習中になるのはよくわからんな。[SEP]体育祭は分かるがブレスの位置も決まってる合唱練習中になるのはよくわからんな…,0,1,7.12,-7.523
6a0453319,news4vip,ふざけてないで作ったら。[SEP]ふざけてないで作ったら?,0,1,7.492,-7.188
98f5ae3b1,news4vip,うん私、面接に行くたびに皆が食いつくのは、営業してた所だよ。[SEP]やっぱ仕事出来る出来ないも大切だけど、人間関係も上手くやってもらいたい気持ちもあるみたい?と昔働いてた同僚が言ってた,0,1,4.184,-5.47
0041b7a03,livejupiter,サッカーはザッケローニ時代は爆上げしてたね毎試合30%超えが当たり前だった。[SEP]サッカーはザッケローニ時代は爆上げしてたね毎試合30%超えが当たり前だったし,0,1,5.477,-5.98
7ab0b34de,livejupiter,そうか二人連続で立て続けにやったから、不具合かと思ってなまた頑張るでサンガ。[SEP]そうか二人連続で立て続けにやったから、不具合かと思ってなまた頑張るでサンガツ,0,1,7.57,-7.55
d18a0cb2d,newsplus,あれは一応被害者とされる側が証拠として録音したと言うていほかに証拠は無かったんだろうか。[SEP]あれは一応被害者とされる側が証拠として録音したと言うていほかに証拠は無かったんだろうか?,0,1,7.645,-7.88
8ad60eda2,livejupiter,あードラポンもあるやねセオリーとしてはこういう時手を変えないほうがいいって思ってるんやけど今回は2sにとったほうがいいかもしれんのや。[SEP]あードラポンもあるやねセオリーとしてはこういう時手を変えないほうがいいって思ってるんやけど今回は2sにとったほうがいいかもしれんのやね,0,1,7.242,-6.59
0da2421cc,newsplus,書きながら、それ考えていたやっぱりか。[SEP]書きながら、それ考えていたやっぱりかー,0,1,7.63,-8.71
5ba24eede,news4vip,逆だろ、日本人には在日の為に四六時中ネトウヨ連呼する動機がな。[SEP]逆だろ、日本人には在日の為に四六時中ネトウヨ連呼する動機がない,0,1,3.982,-3.145
ea5590a3f,news4vip,なんで?他人の箸使わなきゃならないの?なんで、酒飲まなきゃならないの。[SEP]なんで?他人の箸使わなきゃならないの?なんで、酒飲まなきゃならないの?,0,1,5.26,-5.934
718789fbc,news4vip,美咲天使の強制子宮破壊12だったググッたら出てきた。[SEP]美咲天使の強制子宮破壊12だったググッたら出てきたわ,0,1,6.07,-6.355
958508fbb,newsplus,ずれまくってんなあおめーらがやらねーといけねーのはジハードを宣言して全ムスリムにテロリストと戦わせることだろ偏見拡大を阻止とか後からついてくるからまず被害拡大を阻止しろ全力で。[SEP]ずれまくってんなあおめーらがやらねーといけねーのはジハードを宣言して全ムスリムにテロリストと戦わせることだろ偏見拡大を阻止とか後からついてくるからまず被害拡大を阻止しろ全力でだ,1,1,5.35,-4.023
3e4181f68,news4vip,結局学歴フィルターなんだ。[SEP]結局学歴フィルターなんだな,0,1,7.707,-7.918
c6d5dd812,news4vip,火病で暴れないように在日を十字架に釘で固定してから射殺な在日を射殺すれば日本兵の意識高揚にな。[SEP]火病で暴れないように在日を十字架に釘で固定してから射殺な在日を射殺すれば日本兵の意識高揚になる,1,1,-0.631,1.982
2a613e89a,livejupiter,子供がほしけりゃ養子って言う奴アホか?クソキモいホモの養子にされた子供の事考えろ。[SEP]子供がほしけりゃ養子って言う奴アホか?クソキモいホモの養子にされた子供の事考えろや,1,1,1.727,-1.505
6b642e64f,news4vip,バイヤーが風俗連れてってくれ。[SEP]バイヤーが風俗連れてってくれる,0,1,5.496,-5.676
c6acbfe71,newsplus,外国人参政権を与えないことは違憲ではないと言っただけで外国人参政権は違憲とは言ってないけどなー。[SEP]外国人への生活保護も同じ間違いを連呼しているけど基礎的な論理学は勉強しようよ。,0,1,2.809,-2.074
6592cb0b8,news4vip,神道の葬式ってどんな感じ?全然知らない。[SEP]神道の葬式ってどんな感じ?全然知らないわ,0,1,7.402,-5.684
677f106cb,news4vip,移民を受け入れることが現実的なのか?その移民が歳をとったり病気や怪我で働けなくなったりしたらどうする。[SEP]移民を受け入れることが現実的なのか?その移民が歳をとったり病気や怪我で働けなくなったりしたらどうする?,0,1,5.145,-3.916
28b7b9ea9,newsplus,起源主張より他宗教弾圧を大っぴらに始めそう日本の神社仏閣・教会を破壊して礼拝所を作れと強要し、好き勝手に振る舞うイスラム教徒の朝鮮人が急増したりして。[SEP]起源主張より他宗教弾圧を大っぴらに始めそう日本の神社仏閣・教会を破壊して礼拝所を作れと強要し、好き勝手に振る舞うイスラム教徒の朝鮮人が急増したりしてな,0,1,-1.194,1.986
99c570a9c,newsplus,ID:kmy第13艦隊が他の記者に注意されると、どこからともなく飛んできて他記者に噛みつく名無し。[SEP]ID:kmy第13艦隊が他の記者に注意されると、どこからともなく飛んできて他記者に噛みつく名無しね,0,1,5.258,-5.9
7ddad3dc7,livejupiter,同じじゃないから仲良くできないんやぞ人それぞれなのに同じオタクで一括りにするのはおかしいや。[SEP]同じじゃないから仲良くできないんやぞ人それぞれなのに同じオタクで一括りにするのはおかしいやろ,0,1,7.188,-7.55
6b626df29,newsplus,伸るか反るかだと思うんだよね。[SEP]手を出さないか、全面的にやるか。,0,1,5.53,-6.348
c6bf75178,livejupiter,坂本って此処10年には入らないんだっ。[SEP]坂本って此処10年には入らないんだっけ,0,1,6.65,-7.695
3635a3d6d,news4vip,なんや、プライバシーやら何やら言ってたけど結局底辺で惨めになりたくないだけかい。[SEP]なんや、プライバシーやら何やら言ってたけど結局底辺で惨めになりたくないだけかいな,0,1,7.668,-7.824
7331dee62,news4vip,てめえさぁ無実なんだけ。[SEP]てめえさぁ無実なんだけど,0,1,6.41,-5.508
3c0b10158,newsplus,何気に明治大帝はかの山岡鉄舟が侍従についていたから割りと強いかも。[SEP]何気に明治大帝はかの山岡鉄舟が侍従についていたから割りと強いかもw,0,1,7.375,-7.758
5c41f8186,livejupiter,異世界って回復魔法とかあるなら医術とかいらんよな虫歯だろうが癌だろうが魔法で治せるんやったらある意味地球よりも凄い。[SEP]異世界って回復魔法とかあるなら医術とかいらんよな虫歯だろうが癌だろうが魔法で治せるんやったらある意味地球よりも凄いで,0,1,4.355,-5.12
88728e338,news4vip,どこぞの誰か分からんのなんて取るわけないじゃん取引先の〇〇さんの息子さんなら・・・とか身元が分かってないと取らないの。[SEP]親が基地外だったり親族に犯罪者とかいたら困るからな。ブラックは除く,0,1,4.805,-5.438
132487a11,newsplus,どうなのかなあ意地の悪い見方をすると、民主を引っ掻き回す狙いもあるのかなって思う民主は中道左派を自称してるが、こと安保関連になると鍍金が剥がれるから。[SEP]どうなのかなあ意地の悪い見方をすると、民主を引っ掻き回す狙いもあるのかなって思う民主は中道左派を自称してるが、こと安保関連になると鍍金が剥がれるからな,0,1,6.28,-6.598
bff1d082d,news4vip,実際そうなんだからしゃあない朝鮮人を受け入れた組織は例外なく腐っていくジャップの民度然。[SEP]実際そうなんだからしゃあない朝鮮人を受け入れた組織は例外なく腐っていくジャップの民度然り,1,1,-1.496,1.858
524fd98d6,news4vip,おーぷんのアダルトチルドレン年齢逆転現象と同じやね(ニッコリ。[SEP]おーぷんのアダルトチルドレン年齢逆転現象と同じやね(ニッコリ),0,1,6.715,-7.184
5011e69b6,livejupiter,ええんやで暇なんや。[SEP]ええんやで暇なんやな,0,1,7.277,-7.55
104b5f1bf,news4vip,大剣が楽なんじゃない?振り向き様に懐に飛び込んで先に尻尾切っちゃって、後はお腹と羽を場面によって切り分けるといんじゃない?言ってる俺もジンオウガ亜種で1ヶ月詰んでるけどw。[SEP]大剣が楽なんじゃない?振り向き様に懐に飛び込んで先に尻尾切っちゃって、後はお腹と羽を場面によって切り分けるといんじゃない?言ってる俺もジンオウガ亜種で1ヶ月詰んでるけどww,0,1,6.324,-5.79
b8a1787bf,newsplus,所詮、陰謀論だから流すくらいでいいよwあの記者がどうだって対立を煽ることをやりながら自制を求めるってのも変だけどさ某記者への疑問符は俺的にどうやっても外せないってだけだか。[SEP]所詮、陰謀論だから流すくらいでいいよwあの記者がどうだって対立を煽ることをやりながら自制を求めるってのも変だけどさ某記者への疑問符は俺的にどうやっても外せないってだけだから,0,1,7.24,-7.11
afaae84aa,livejupiter,解剖で切った耳を壁につけて壁に耳ありってやって退学になったうわさ思い出し。[SEP]解剖で切った耳を壁につけて壁に耳ありってやって退学になったうわさ思い出した,0,1,7.07,-8.15
708a85d4a,livejupiter,市川学園ニッケコルトンプラザ(あるんか?)ぐらいしか思い浮かばん。[SEP]市川学園ニッケコルトンプラザ(あるんか?)ぐらいしか思い浮かばんな,0,1,6.805,-7.285
5f368194c,newsplus,?上手くないって言われたのかな…でもまあ本当に好きなら一要素が合わないくらいなら諦めるだろうけど。[SEP]?上手くないって言われたのかな…でもまあ本当に好きなら一要素が合わないくらいなら諦めるだろうけど…,0,1,8.04,-8.28
768601d40,news4vip,草の根BBSとかいうやつで、一種の古典的なローカルエリアネットワークみたいなもんだったのかないまでも、大学構内や研究所内の閉鎖回線網に直接接続しないとアクセスできないウェブページってあると思うけど、それと一緒やね30年くらい前の。[SEP]草の根BBSとかいうやつで、一種の古典的なローカルエリアネットワークみたいなもんだったのかないまでも、大学構内や研究所内の閉鎖回線網に直接接続しないとアクセスできないウェブページってあると思うけど、それと一緒やね30年くらい前の話,0,1,5.824,-6.473
725f8c3c8,newsplus,いい画像だと思ったので保存したつもりだったんだけどねどうもしてなかったっぽいわ。[SEP]残念どのスレだったかねえ・・・w,0,1,6.082,-6.64
c8ce9384d,newsplus,トンネルについては北陸新幹線と第三セクターほくほく線の工事経験あるから大丈夫かと。[SEP],0,1,5.29,-6.297
851afaa96,newsplus,戦時中は連合国がユダヤ人を積極的に助ける理由は無いからねw戦後は自分達の正当化に必要だったけど。[SEP]戦時中は連合国がユダヤ人を積極的に助ける理由は無いからねw戦後は自分達の正当化に必要だったけどw,0,1,5.258,-5.043
49b6c083a,livejupiter,女はモノ感覚なので0人ゲーム機と一緒で新品じゃなきゃ嫌ちな。[SEP]女はモノ感覚なので0人ゲーム機と一緒で新品じゃなきゃ嫌ちな童,0,1,-0.542,-0.4138
724f7ffc2,newsplus,そうなんだ、宗教に対する信頼が無ければこんな法律存在しないだろう。[SEP]そうなんだ、宗教に対する信頼が無ければこんな法律存在しないだろうね,0,1,5.28,-5.312
b66910aa0,news4vip,ようやくチョン消えたかなマジで気持ち悪いわ日本から出てけよチョ。[SEP]ようやくチョン消えたかなマジで気持ち悪いわ日本から出てけよチョン,1,1,-3.945,3.803
e099d5cde,news4vip,在日は日本にいる以上、日本人の奴隷なんだから調子に乗るのは死に値するそれが守れないなら日本から出て行。[SEP]在日は日本にいる以上、日本人の奴隷なんだから調子に乗るのは死に値するそれが守れないなら日本から出て行け,1,1,-6.082,6.727
432f83c32,newsplus,いや、経済力の無いおっさんだよ毎日惨めだ。[SEP]いや、経済力の無いおっさんだよ毎日惨めだわ,0,1,5.934,-6.48
7d8057d79,newsplus,おい、お前ら!Amazonトップページ見てみろ。[SEP]おい、お前ら!Amazonトップページ見てみろ!,0,1,7.453,-7.27
f2b18ae4a,newsplus,そしてそれらの異常な状態の指摘をヘイトだ、差別扇動だと認定しているのならそしてそんな基準で動画削除だので騒いでいるのなら、こんなに恐ろしいことはないと思。[SEP]そしてそれらの異常な状態の指摘をヘイトだ、差別扇動だと認定しているのならそしてそんな基準で動画削除だので騒いでいるのなら、こんなに恐ろしいことはないと思う,0,1,5.18,-5.645
2460f58cf,livejupiter,イッチは客観性無さ過ぎやろ日本だって中国人がいろいろ買ってるけど別に感謝とかしないやろ?それ以前の問題やから。[SEP]イッチは客観性無さ過ぎやろ日本だって中国人がいろいろ買ってるけど別に感謝とかしないやろ?それ以前の問題やからな,0,1,5.867,-5.973
0e3ffc606,newsplus,すまん勇み足りchみたいになってはいかんね事実のみ粛々といかに。[SEP]すまん勇み足りchみたいになってはいかんね事実のみ粛々といかにゃ,0,1,7.426,-6.93
cf8043045,newsplus,そろそろ増田サゲがパヨク工作員に見えてきたどんなに工作してもいろいろな意見を見た上で自分で考えて投票するから少し黙っていてく。[SEP]そろそろ増田サゲがパヨク工作員に見えてきたどんなに工作してもいろいろな意見を見た上で自分で考えて投票するから少し黙っていてくれ,0,1,6.0,-6.305
4e31b4e5d,news4vip,金融緩和は起爆剤みたいなもんだからな使いすぎたらオシャカになるんじゃね。[SEP]金融緩和は起爆剤みたいなもんだからな使いすぎたらオシャカになるんじゃね?,0,1,6.535,-6.793
e634465e4,newsplus,正直若干不安があるアメが「侵略」と言えるような形で外国に影響を与えた場合も含まれるのかという一点のみだけどこのケースだったとき支援を拒否できるなら文句ない。[SEP]正直若干不安があるアメが「侵略」と言えるような形で外国に影響を与えた場合も含まれるのかという一点のみだけどこのケースだったとき支援を拒否できるなら文句ないわ,0,1,6.992,-6.61
ecacef06f,livejupiter,童の者たちの女は論理的思考をしないとか言う感情論す。[SEP]童の者たちの女は論理的思考をしないとか言う感情論すき,0,1,0.3462,-0.953
a728f26db,news4vip,すまないがそれはレンジのほうか?それともトースター。[SEP]すまないがそれはレンジのほうか?それともトースター?,0,1,7.51,-8.05
e5896e67f,news4vip,世界大戦の犠牲者数が最も少ないし最も恩恵受けてた民族が裏切ったから。[SEP]世界大戦の犠牲者数が最も少ないし最も恩恵受けてた民族が裏切ったからな,0,1,5.348,-5.54
1f5db8da1,news4vip,そ、そうなのかwつーか、女にどれだけ恨みあるのかと何か・・・あれだ。[SEP],0,1,3.463,-3.746
9330e8b61,news4vip,せやでIDもうすこしでnhkや。[SEP]せやでIDもうすこしでnhkやな,0,1,7.08,-8.05
9215eff89,news4vip,円満に辞めたいのなら当然早めに辞める日も伝えるわけで会社側もそれに応じて人員募集するわけだがそれができないような会社に対して円満退社とかアホなん。[SEP]円満に辞めたいのなら当然早めに辞める日も伝えるわけで会社側もそれに応じて人員募集するわけだがそれができないような会社に対して円満退社とかアホなん?,0,1,5.67,-6.57
8c97d4c48,newsplus,あっち系の連中は、先にストーリーを決めて、少しでもずれると激高する。[SEP]アスペルガーの症状そのまんまなんだが。,0,1,4.277,-5.094
acd4749a8,news4vip,あっさりが好きなだ。[SEP]あっさりが好きなだけ,0,1,5.0,-6.492
ed779ad46,news4vip,一応iPhoneの明るさ1番暗くしたんだけど…だめ?本当に泣きそうもう無理降りたい。[SEP],0,1,5.066,-5.2
c7507859e,news4vip,アメリカと戦うなんて言ってないよ自分の国は自分達で守るって言ってるだ。[SEP]アメリカと戦うなんて言ってないよ自分の国は自分達で守るって言ってるだけ,0,1,6.992,-7.24
208557eeb,newsplus,手際の悪さが批判されるより先に「あいつらならやりかねない」と思われていたってことでもあ。[SEP]手際の悪さが批判されるより先に「あいつらならやりかねない」と思われていたってことでもある,0,1,7.637,-7.668
f6785b7b5,newsplus,これなw、朝鮮人が妄想全開というか捏造で世論工作しているのがバレバレだわな安倍は粛々と対抗措置を継続して嘘がばれたら今度はアメリカ持ち出したんだろうが無駄な足掻きだ。[SEP]これなw、朝鮮人が妄想全開というか捏造で世論工作しているのがバレバレだわな安倍は粛々と対抗措置を継続して嘘がばれたら今度はアメリカ持ち出したんだろうが無駄な足掻きだわ,0,1,0.4878,-0.7847
f11c79556,newsplus,なら君も「党員」扱いされてもしょうがないよw見分けつかないレベルだし。[SEP]なら君も「党員」扱いされてもしょうがないよw見分けつかないレベルだしね,0,1,8.02,-7.656
85b050d59,livejupiter,雪虫は糞やチャリ漕ぐと口に入るし全身にくっつくしかも潰れやすいから取るのミスると服に体液つ。[SEP]雪虫は糞やチャリ漕ぐと口に入るし全身にくっつくしかも潰れやすいから取るのミスると服に体液つく,0,1,4.83,-4.95
0ef0d12ea,newsplus,"相変わらずテレビメディアはトンチンカンな事をしてますね日本は黒人は他の外国人と同じに扱われて、今まで黒人差別問題は""ほぼ""無かったので、高齢者はピント来ないし意味無しだと思。[SEP]相変わらずテレビメディアはトンチンカンな事をしてますね日本は黒人は他の外国人と同じに扱われて、今まで黒人差別問題は""ほぼ""無かったので、高齢者はピント来ないし意味無しだと思う",0,1,1.755,-0.311
9d790a66e,news4vip,それ、日本人の拉致云々関係なくイエズス会が軍艦を保有するに至り脅威として排除しただけだよな。[SEP]それ、日本人の拉致云々関係なくイエズス会が軍艦を保有するに至り脅威として排除しただけだよなw,0,1,4.047,-3.58
